{
  "format": "anyps5-report",
  "version": 1,
  "generated": "2026-10-29T12:00:00Z",
  "anyps5": {
    "commit": "40f2a9c3d1b7e5864a0c9d2e7f13b5a8c6d49e01",
    "release": null,
    "modified": true
  },
  "game": {
    "titleId": "PPSA12345",
    "contentId": "UP9000-PPSA12345_00-EXAMPLE00000000A",
    "contentVersion": "01.002.000",
    "name": "Example Game"
  },
  "system": {
    "os": "windows",
    "osVersion": "Windows 11 10.0.22631",
    "cpu": "Intel Core i7-12700K",
    "ramGiB": 32,
    "gpu": {
      "vendor": "NVIDIA",
      "name": "GeForce RTX 3070",
      "driver": "552.44",
      "vulkan": "1.3.280"
    }
  },
  "run": {
    "id": "52d07b9e1a6c4f38b4e2a10c7f9d8e63",
    "seconds": 205.7,
    "exit": "crash",
    "exitCode": 3221225477,
    "stage": "presents",
    "milestones": {
      "loaded": 1.2,
      "started": 1.4,
      "firstDraw": 8.9,
      "firstPresent": 9.3
    },
    "framesPresented": 7340,
    "averageFps": 38.9,
    "fpsWindowSeconds": 188.7,
    "recovered": false,
    "incomplete": false
  },
  "coverage": {
    "milestones": true,
    "missing": true,
    "shaders": true,
    "unsupported": true,
    "imageFormats": true,
    "descriptors": true
  },
  "truncated": {
    "functions": 0,
    "unsupported": 0,
    "imageFormats": 0,
    "descriptors": 0
  },
  "missing": {
    "functions": []
  },
  "shaders": {
    "compiled": 1234,
    "failed": 0,
    "cacheHits": 5120,
    "unsupported": [],
    "imageFormats": [
      {
        "format": 37,
        "name": "Format8_8_8_8Srgb",
        "status": "accepted",
        "usage": "sampled",
        "count": 412
      },
      {
        "format": 10,
        "name": "Format8_8_8_8UNorm",
        "status": "accepted",
        "usage": "color-target",
        "count": 96
      }
    ],
    "descriptors": [
      {
        "type": "SampledImage",
        "status": "accepted",
        "usage": "read",
        "count": 2210
      },
      {
        "type": "UniformBuffer",
        "status": "accepted",
        "usage": "read",
        "count": 1874
      },
      {
        "type": "Sampler",
        "status": "accepted",
        "usage": "read",
        "count": 640
      }
    ]
  },
  "stop": {
    "kind": "crash",
    "reason": "crash",
    "message": "The process ended with an unhandled access violation.",
    "source": null
  }
}
