{
  "format": "anyps5-report",
  "version": 1,
  "generated": "2026-10-29T12:00:00Z",
  "anyps5": {
    "commit": "40f2a9c3d1b7e5864a0c9d2e7f13b5a8c6d49e01",
    "release": "v0.1.3",
    "modified": false
  },
  "game": {
    "titleId": "PPSA12345",
    "contentId": "UP9000-PPSA12345_00-EXAMPLE00000000A",
    "contentVersion": "01.002.000",
    "name": "Example Game"
  },
  "system": {
    "os": "macos",
    "osVersion": "macOS 14.5",
    "cpu": "Apple M2",
    "ramGiB": 16,
    "gpu": {
      "vendor": "Apple",
      "name": "Apple M2",
      "driver": "MoltenVK 1.2.9",
      "vulkan": "1.2.283"
    }
  },
  "run": {
    "id": "e8431f0a6b9d4c27a3b5d1c80e7f2946",
    "seconds": 19.3,
    "exit": "abort",
    "exitCode": 134,
    "stage": "starts",
    "milestones": {
      "loaded": 1.0,
      "started": 1.2
    },
    "framesPresented": 0,
    "averageFps": null,
    "fpsWindowSeconds": null,
    "recovered": false,
    "incomplete": false
  },
  "coverage": {
    "milestones": true,
    "missing": true,
    "shaders": true,
    "unsupported": true,
    "imageFormats": true,
    "descriptors": true
  },
  "truncated": {
    "functions": 0,
    "unsupported": 0,
    "imageFormats": 0,
    "descriptors": 0
  },
  "missing": {
    "functions": []
  },
  "shaders": {
    "compiled": 0,
    "failed": 0,
    "cacheHits": 0,
    "unsupported": [],
    "imageFormats": [],
    "descriptors": []
  },
  "stop": {
    "kind": "assert",
    "reason": "crash",
    "message": "A runtime assertion failed: guest memory range is not mapped.",
    "source": "core/libs/prx/libkernel/DirectMemory/Export.cpp:214"
  }
}
