{
  "format": "anyps5-report",
  "version": 1,
  "generated": "2026-10-29T12:00:00Z",
  "anyps5": {
    "commit": "40f2a9c3d1b7e5864a0c9d2e7f13b5a8c6d49e01",
    "release": "v0.1.3",
    "modified": false
  },
  "game": {
    "titleId": "PPSA12345",
    "contentId": "UP9000-PPSA12345_00-EXAMPLE00000000A",
    "contentVersion": "01.002.000",
    "name": "Example Game"
  },
  "system": {
    "os": "linux",
    "osVersion": "Arch Linux (kernel 6.11)",
    "cpu": "AMD Ryzen 7 5800X",
    "ramGiB": 32,
    "gpu": {
      "vendor": "AMD",
      "name": "Radeon RX 6800",
      "driver": "Mesa 24.2.3 (RADV)",
      "vulkan": "1.3.289"
    }
  },
  "run": {
    "id": "d4f6a8c20e1b4735a9c3b7e5d1f08a62",
    "seconds": 33.0,
    "exit": "clean",
    "exitCode": 0,
    "stage": "starts",
    "milestones": {
      "loaded": 1.1,
      "started": 1.3
    },
    "framesPresented": 0,
    "averageFps": null,
    "fpsWindowSeconds": null,
    "recovered": false,
    "incomplete": false
  },
  "coverage": {
    "milestones": true,
    "missing": true,
    "shaders": true,
    "unsupported": true,
    "imageFormats": true,
    "descriptors": true
  },
  "truncated": {
    "functions": 0,
    "unsupported": 0,
    "imageFormats": 0,
    "descriptors": 0
  },
  "missing": {
    "functions": []
  },
  "shaders": {
    "compiled": 0,
    "failed": 0,
    "cacheHits": 0,
    "unsupported": [],
    "imageFormats": [],
    "descriptors": []
  },
  "stop": {
    "kind": "none",
    "reason": "quit-requested",
    "message": "The window was closed.",
    "source": null
  }
}
