{
  "format": "anyps5-report",
  "version": 1,
  "generated": "2026-10-29T12:00:00Z",
  "anyps5": {
    "commit": "40f2a9c3d1b7e5864a0c9d2e7f13b5a8c6d49e01",
    "release": "v0.1.3",
    "modified": false
  },
  "game": {
    "titleId": "PPSA12345",
    "contentId": "UP9000-PPSA12345_00-EXAMPLE00000000A",
    "contentVersion": "01.002.000",
    "name": "Example Game"
  },
  "system": {
    "os": "linux",
    "osVersion": "Arch Linux (kernel 6.11)",
    "cpu": "AMD Ryzen 7 5800X",
    "ramGiB": 32,
    "gpu": {
      "vendor": "AMD",
      "name": "Radeon RX 6800",
      "driver": "Mesa 24.2.3 (RADV)",
      "vulkan": "1.3.289"
    }
  },
  "run": {
    "id": "0b6d2f81c9e347a5b1d08f4e6a2c9375",
    "seconds": 61.2,
    "exit": "abort",
    "exitCode": 134,
    "stage": "first-draw",
    "milestones": {
      "loaded": 1.2,
      "started": 1.5,
      "firstDraw": 40.8
    },
    "framesPresented": 0,
    "averageFps": null,
    "fpsWindowSeconds": null,
    "recovered": false,
    "incomplete": false
  },
  "coverage": {
    "milestones": true,
    "missing": true,
    "shaders": true,
    "unsupported": true,
    "imageFormats": true,
    "descriptors": true
  },
  "truncated": {
    "functions": 0,
    "unsupported": 0,
    "imageFormats": 0,
    "descriptors": 0
  },
  "missing": {
    "functions": []
  },
  "shaders": {
    "compiled": 311,
    "failed": 2,
    "cacheHits": 5120,
    "unsupported": [
      {
        "encoding": "VOP3",
        "opcode": "V_CVT_PK_U8_F32",
        "opcodeValue": 494,
        "modifiers": [
          "clamp"
        ],
        "count": 2
      },
      {
        "encoding": "VOP3",
        "opcode": null,
        "opcodeValue": 711,
        "modifiers": null,
        "count": 1
      }
    ],
    "imageFormats": [
      {
        "format": 37,
        "name": "Format8_8_8_8Srgb",
        "status": "accepted",
        "usage": "sampled",
        "count": 412
      },
      {
        "format": 10,
        "name": "Format8_8_8_8UNorm",
        "status": "accepted",
        "usage": "color-target",
        "count": 96
      }
    ],
    "descriptors": [
      {
        "type": "SampledImage",
        "status": "accepted",
        "usage": "read",
        "count": 2210
      },
      {
        "type": "UniformBuffer",
        "status": "accepted",
        "usage": "read",
        "count": 1874
      },
      {
        "type": "Sampler",
        "status": "accepted",
        "usage": "read",
        "count": 640
      }
    ]
  },
  "stop": {
    "kind": "unsupported-shader",
    "reason": "runtime-stop",
    "message": "Shader uses an unsupported VOP3 instruction (V_CVT_PK_U8_F32).",
    "source": "core/shader/recompiler/Translator/src/Vop3.cpp:812"
  }
}
